{
  "$comment": "Runtime-only invariants include canonical manifest paths, cross-resource references, duplicate identifiers, and resolved case-id collisions.",
  "$defs": {
    "__schema0": {
      "anyOf": [
        {
          "type": "string"
        },
        {
          "type": "number"
        },
        {
          "type": "boolean"
        },
        {
          "type": "null"
        },
        {
          "items": {
            "$ref": "#/$defs/__schema0"
          },
          "type": "array"
        },
        {
          "additionalProperties": {
            "$ref": "#/$defs/__schema0"
          },
          "propertyNames": {
            "type": "string"
          },
          "type": "object"
        }
      ]
    },
    "__schema1": {
      "anyOf": [
        {
          "type": "string"
        },
        {
          "type": "number"
        },
        {
          "type": "boolean"
        },
        {
          "type": "null"
        },
        {
          "items": {
            "$ref": "#/$defs/__schema1"
          },
          "type": "array"
        },
        {
          "additionalProperties": {
            "$ref": "#/$defs/__schema1"
          },
          "propertyNames": {
            "type": "string"
          },
          "type": "object"
        }
      ]
    },
    "__schema2": {
      "anyOf": [
        {
          "type": "string"
        },
        {
          "type": "number"
        },
        {
          "type": "boolean"
        },
        {
          "type": "null"
        },
        {
          "items": {
            "$ref": "#/$defs/__schema2"
          },
          "type": "array"
        },
        {
          "additionalProperties": {
            "$ref": "#/$defs/__schema2"
          },
          "propertyNames": {
            "type": "string"
          },
          "type": "object"
        }
      ]
    }
  },
  "$schema": "https://json-schema.org/draft/2020-12/schema",
  "additionalProperties": false,
  "properties": {
    "expected": {
      "$ref": "#/$defs/__schema1"
    },
    "id": {
      "pattern": "^[a-z][a-z0-9]*(?:-[a-z0-9]+)*$",
      "type": "string"
    },
    "input": {
      "$ref": "#/$defs/__schema0"
    },
    "metric_overrides": {
      "items": {
        "additionalProperties": false,
        "properties": {
          "enabled": {
            "type": "boolean"
          },
          "metric_id": {
            "pattern": "^[a-z][a-z0-9]*(?:-[a-z0-9]+)*$",
            "type": "string"
          },
          "threshold": {
            "type": "number"
          }
        },
        "required": [
          "metric_id"
        ],
        "type": "object"
      },
      "type": "array"
    },
    "params": {
      "additionalProperties": {
        "$ref": "#/$defs/__schema2"
      },
      "propertyNames": {
        "type": "string"
      },
      "type": "object"
    },
    "tags": {
      "items": {
        "minLength": 1,
        "type": "string"
      },
      "type": "array"
    }
  },
  "required": [
    "id",
    "input"
  ],
  "type": "object"
}
